{
  "evidence_class": "REAL-PUBLIC",
  "project": "uav-fault",
  "dataset": "dronepropa",
  "task": "fault_type_classification_4class",
  "split": "leave_one_flight_out",
  "seed": 42,
  "git_sha": "7f3d4dd",
  "dataset_sha256": "aaaefe44030f08ddeb7884178bfafdd071aace38e62222093ad5a81ecaf73ec8",
  "metrics": {
    "logreg_macro_f1": 0.540503646293823,
    "logreg_accuracy": 0.5275590551181102,
    "logreg_healthy_precision": 0.4222222222222222,
    "logreg_healthy_recall": 0.475,
    "logreg_healthy_f1": 0.4470588235294118,
    "logreg_healthy_support": 40,
    "logreg_edge_cut_precision": 0.7391304347826086,
    "logreg_edge_cut_recall": 0.5666666666666667,
    "logreg_edge_cut_f1": 0.6415094339622641,
    "logreg_edge_cut_support": 30,
    "logreg_crack_precision": 0.41379310344827586,
    "logreg_crack_recall": 0.4,
    "logreg_crack_f1": 0.4067796610169492,
    "logreg_crack_support": 30,
    "logreg_surface_cut_precision": 0.6333333333333333,
    "logreg_surface_cut_recall": 0.7037037037037037,
    "logreg_surface_cut_f1": 0.6666666666666666,
    "logreg_surface_cut_support": 27,
    "random_forest_macro_f1": 0.5310572289967429,
    "random_forest_accuracy": 0.5196850393700787,
    "random_forest_healthy_precision": 0.40425531914893614,
    "random_forest_healthy_recall": 0.475,
    "random_forest_healthy_f1": 0.4367816091954023,
    "random_forest_healthy_support": 40,
    "random_forest_edge_cut_precision": 0.6923076923076923,
    "random_forest_edge_cut_recall": 0.6,
    "random_forest_edge_cut_f1": 0.6428571428571429,
    "random_forest_edge_cut_support": 30,
    "random_forest_crack_precision": 0.5161290322580645,
    "random_forest_crack_recall": 0.5333333333333333,
    "random_forest_crack_f1": 0.5245901639344263,
    "random_forest_crack_support": 30,
    "random_forest_surface_cut_precision": 0.5652173913043478,
    "random_forest_surface_cut_recall": 0.48148148148148145,
    "random_forest_surface_cut_f1": 0.52,
    "random_forest_surface_cut_support": 27
  },
  "produced_by": "experiments/uav/run_fault_clf.py",
  "notes": "Baselines on DronePropA (127 flights, F0=40/F1=30/F2=30/F3=27). Features: 21 channels x 8 features = 168 per flight (rows 24-26,27-38,46,47-54 of QDrone_data; stat: mean/std/min/max/rms/variance; fft: spectral_entropy, dominant_freq_magnitude_ratio). Split: GroupKFold(5) on group_id (filename). No flight in both train and test. Confusion matrices printed to stdout; per-class P/R/F1 in metrics."
}