{
  "evidence_class": "SIMULATED",
  "project": "uav-fault",
  "dataset": "dronepropa",
  "task": "fault_type_classification_4class",
  "split": "leave_one_flight_out",
  "seed": 42,
  "git_sha": "f940e31",
  "dataset_sha256": "aaaefe44030f08ddeb7884178bfafdd071aace38e62222093ad5a81ecaf73ec8",
  "metrics": {
    "gb_macro_f1": 0.5614842848443597,
    "gb_accuracy": 0.5590551181102362,
    "gb_healthy_precision": 0.4897959183673469,
    "gb_healthy_recall": 0.6,
    "gb_healthy_f1": 0.5393258426966292,
    "gb_healthy_support": 40,
    "gb_edge_cut_precision": 0.6086956521739131,
    "gb_edge_cut_recall": 0.4666666666666667,
    "gb_edge_cut_f1": 0.5283018867924528,
    "gb_edge_cut_support": 30,
    "gb_crack_precision": 0.6296296296296297,
    "gb_crack_recall": 0.5666666666666667,
    "gb_crack_f1": 0.5964912280701754,
    "gb_crack_support": 30,
    "gb_surface_cut_precision": 0.5714285714285714,
    "gb_surface_cut_recall": 0.5925925925925926,
    "gb_surface_cut_f1": 0.5818181818181818,
    "gb_surface_cut_support": 27,
    "cnn_macro_f1": 0.38182382133995035,
    "cnn_accuracy": 0.4566929133858268,
    "cnn_healthy_precision": 0.5,
    "cnn_healthy_recall": 0.925,
    "cnn_healthy_f1": 0.6491228070175439,
    "cnn_healthy_support": 40,
    "cnn_edge_cut_precision": 0.37037037037037035,
    "cnn_edge_cut_recall": 0.3333333333333333,
    "cnn_edge_cut_f1": 0.3508771929824561,
    "cnn_edge_cut_support": 30,
    "cnn_crack_precision": 0.3181818181818182,
    "cnn_crack_recall": 0.23333333333333334,
    "cnn_crack_f1": 0.2692307692307692,
    "cnn_crack_support": 30,
    "cnn_surface_cut_precision": 1.0,
    "cnn_surface_cut_recall": 0.14814814814814814,
    "cnn_surface_cut_f1": 0.25806451612903225,
    "cnn_surface_cut_support": 27
  },
  "produced_by": "experiments/uav/run_fault_clf_strong.py",
  "notes": "Stronger models on DronePropA (127 flights, F0=40/F1=30/F2=30/F3=27). gb: HistGradientBoostingClassifier on 192 features (24 ch x 8 stat/fft). cnn: 1D-CNN over 24 raw verified channels (rows 24-26,27-38,46,47-54), resampled to 1024 time steps, 30 epochs, batch 16. Split: GroupKFold(5) on group_id (filename). No flight in both train and test. Confusion matrices printed to stdout; per-class P/R/F1 in metrics."
}